{"agent_outcome_affected":false,"benchmark_retry_triggered":false,"counters":{"artifact_bytes_written":1554489,"artifacts_written":165,"dropped_events":0,"events_written":237,"redactions_applied":276,"sequence_gaps":0},"failure_policy":"continue_agent_without_retry","finalization":"clean","generated_at":"2026-07-28T05:30:15.077Z","issues":[],"schema_digest":"c54f3134f6d71167a7af3647f729a706dc5677edac914b89860a2a50c1d32d9a","schema_version":"benchmark-trace/v1","status":"healthy","trace_id":"trace-f76d27b218e6420d81aff109c905a91f"}
