{"agent_outcome_affected":false,"benchmark_retry_triggered":false,"counters":{"artifact_bytes_written":158704,"artifacts_written":5,"dropped_events":0,"events_written":13,"redactions_applied":2,"sequence_gaps":0},"failure_policy":"continue_agent_without_retry","finalization":"recovered","generated_at":"2026-08-10T23:14:38.232Z","issues":[{"code":"trace.process_recovery","count":1,"first_seen_at":"2026-08-10T23:14:38.197Z","last_seen_at":"2026-08-10T23:14:38.197Z","message":"Trace finalization resumed from durable journals","severity":"warning"}],"schema_digest":"c54f3134f6d71167a7af3647f729a706dc5677edac914b89860a2a50c1d32d9a","schema_version":"benchmark-trace/v1","status":"degraded","trace_id":"trace-5c179851f34949e6834176638b5feacd"}
