{"agent_outcome_affected":false,"benchmark_retry_triggered":false,"counters":{"artifact_bytes_written":391905,"artifacts_written":158,"dropped_events":0,"events_written":243,"redactions_applied":42,"sequence_gaps":0},"failure_policy":"continue_agent_without_retry","finalization":"partial","generated_at":"2026-07-28T00:57:13.710Z","issues":[{"code":"openhands.child_persistence_incomplete","count":2,"first_seen_at":"2026-07-28T00:57:13.417Z","last_seen_at":"2026-07-28T00:57:13.444Z","message":"One or more durable child conversations lacked a complete state and contiguous event sequence","severity":"warning"}],"schema_digest":"c54f3134f6d71167a7af3647f729a706dc5677edac914b89860a2a50c1d32d9a","schema_version":"benchmark-trace/v1","status":"degraded","trace_id":"trace-124fdfc379344037b665ff909dce25af"}
